{
  "data": [
    {
      "id": "682ec1a476e73a98539fb20e",
      "application_id": "146387",
      "loan_amount": "1400000",
      "portfolio_type": "msme tl",
      "legal_stage": "ASSIGNED_TO_CREDIT",
      "home_branch_code": null,
      "loan_branch": null,
      "property_ids": null,
      "queries": null,
      "query_raised_on": 1748017987853,
      "applicant_name": "VIKAS",
      "transaction_type": null,
      "vendors": null,
      "updated_at": null,
      "homeAccess": 1,
      "filter": null,
      "bt_application_id": null,
      "case_bt": null,
      "case_topup": null,
      "case_bt_topup": null,
      "property_id": 1,
      "property_type": "residential",
      "vendor_email": null,
      "property_address": {
        "area": "MANDSAUR",
        "city": "MANDSAUR",
        "state": "MADHYA PRADESH",
        "taluka": "MANDSAUR",
        "pincode": 458883,
        "district": "MANDSAUR",
        "landmark": "",
        "address_line_1": "KHASRA NO 297 PH NO 09 GRAM CHANDWASA ",
        "address_line_2": "TEHSIL SHAMGARH JILA MANDSAUR",
        "same_as_current_address": true,
        "same_as_permanent_address": false
      },
      "property_ownership": {
        "type": "joint",
        "property_owners": [
          {
            "owner_id": 313081,
            "owner_name": "DAYARAM PRAJAPATI",
            "owner_type": "Non-Financial Co-Applicant"
          },
          {
            "owner_id": 313086,
            "owner_name": "BHAGVANTI BAI",
            "owner_type": "Non-Financial Co-Applicant"
          }
        ]
      },
      "vendor_remarks": [
        {
          "remark_id": 1,
          "send_back_prop_id": -1,
          "re_trigger_prop_id": -1,
          "text": "Legal Report is okay",
          "section": "legal",
          "sub_section": "vendor",
          "role": "LV",
          "created_by": {
            "name": null,
            "email": "RajeshKumarRathore@capriapps.in",
            "emp_code": "",
            "emp_name": "",
            "designation": "",
            "branch_code": null,
            "allowed_branches": [

            ]
          },
          "created_at": 1748082363335,
          "property_ids": [
            1
          ]
        }
      ],
      "sendback_remarks": [

      ],
      "legal_reference": {
        "legal_branch_code": "surshg01",
        "legal_coordinator": "Ankush.Sharma2@caprihomeloans.com",
        "assigned_on": null,
        "legal_manager": "Virendra.Chouhan@caprihomeloans.com",
        "legal_approver_designation": null,
        "legal_branch_name": null,
        "legal_coordinator_emp_code": null,
        "legal_coordinator_name": null,
        "la_status": "APPROVE",
        "legal_approver_submitted_on": 1748095330805,
        "legal_approver_assigned_on": null,
        "legal_manager_assigned_on": 1748083930650
      },
      "vendor_reference": {
        "re_trigger_prop_id": -1,
        "vendor_email": "RajeshKumarRathore@capriapps.in",
        "vendor_id": "661162c4d8b2bbfd3e93c2ee",
        "vendor_name": "RAJESH KUMAR RATHORE",
        "assigned_on": 1748072699789,
        "created_at": 1748072699789,
        "created_by": "Ankush.Sharma2@caprihomeloans.com",
        "v_type": "external"
      },
      "is_referred": null,
      "is_reassign": null,
      "is_retrigger": false,
      "is_disabled": null,
      "legal_opinion_report": "loanxpress-cgcl-prod-backend/upload_docs/application_form/LORreport_146387_1_1748081390542.pdf",
      "search_report": "loanxpress-cgcl-prod-backend/upload_docs/user/146387_Tsr_Shamgarh_2.pdf_1748082325363.pdf",
      "is_send_back": false,
      "decision": "positive",
      "query_resolved_on": null
    }
  ],
  "msg": "Success",
  "count": 1,
  "is_submitted": true,
  "refer_user": true,
  "is_single_prop": true
}